Monster Name,Description
Giant Fire Beetle,"Small beast,  unaligned  Armor Class 13  (natural armor) Hit Points 4 (1d6 + 1) Speed 30ft. "
Giant Frog,"Medium  beast,  unaligned  Armor Class  11 Hit  Points  18  (4d8) Speed 30ft., swim  30 ft. "
Giant Goat,"Large beast,  unaligned  Armor Class 11 (natural armor) . Hit Points 19  (3d10 + 3) Speed 40ft. "
Giant Hyena,"Large  beast,  unaligned  Armor Class 12 Hit Points 45  (6d10 + 12) Speed 50 ft. "
Giant Lizard,"Large beast,  unaligned  Armor Class 12  (natu ral  armor) Hit Points 19  (3d10 + 3) Speed 30ft., climb 30ft. "
Giant Octopus,"Large beast,  unaligned  Armor Class 11 Hit Points 52  (8d10 + 8) Speed 10ft., swim  60ft. "
Giant Owl,"Large beast,"" neutral  Armor Class 12 Hit Points 19  (3d1 0 + 3) Speed 5 ft.,  fly  60ft.  )'.10\ lCE. "
Giant Poisonous Snake,"Medium  beast,  unaligned  Armor Class 14 Hit  Points 11  (2d8 + 2) Speed 30ft., swim  30ft.  Pack Tactics.  The  rat has  advantage on  an  attack roll  against a creature if at least one of the rat's allies  is  within  5 feet of the creature and the ally  isn't incapacitated. "
Giant Rat,"Small beast, unaligned  Armor Class 12 Hit Points  7 (2d6) Speed 30ft. "
Giant Scorpion,"Large  beast,  unaligned  Armor Class  15  (natural armor) Hit Points 52  (7d10 + 14) Speed 40ft. "
Giant Sea Horse,"Large beast,  unaligned  Armor Class  l3  (natural armor) Hit Points 16  (3d10) Speed 0 ft.,  swim 40ft. "
Giant Shark,"Huge  beast, unaligned  Armor Class  l3  (natural armor) Hit Points 126  (11d12 +55) Speed 0 ft.,  swim  50 ft . "
Giant Spider,"Large beast,  unaligned  Armor Class 14  (natural armor) Hit Points 26  (4d10 + 4) Speed  30ft., climb 30ft. "
Giant Toad,"Large beast,  unaligned  Armor Class  11 Hit Points 39  (6d10 + 6) Speed 20  ft.,  swim 40ft. "
Giant Vulture,"Large  beast,  neutral evil  Armor Class 10 Hit  Points 22  (3d10 + 6) Speed 10ft., fly  60ft. "
Giant Wasp,"Medium  beast,  unaligned  Armor Class 12 Hit  Points 13  (3d8) Speed 10ft., fly  50 ft.  Standing Leap. The toad's long jump is  up to  20 feet  and  its high  jump is  up to 10 feet,  with  or without a running start. "
Giant Weasel,"Medium  beast,  unaligned  Armor Class  13 Hit Points 9 (2d8) Speed 40ft. "
Giant Wolf Spider,"Medium  beast,  unaligned  Armor Class 13 Hit  Points  11  (2d8 + 2) Speed 40 ft.,  cl imb 40 ft . "
Gibbering Mouther,"Of all the terrors created by foul sorcery, gibbering mouthers are among the most wicked and depraved. This creature is the composite eyes, mouths, and liquefied matter of its former victims. Driven to insanity by the destruction of their bodies and absorption into the mouther, those victims gibber incoherent madness, forced  to consume everything in reach.  Amoeboid Form. The gibbering mouther's body is an amorphous mass of mouths and eyes that propels itself by oozing forward,  fastening several mouths to  the ground and pulling its bulk behind. Though it moves slowly, it swims through water, mud, and quicksand with ease.  Mouths of Madness. When a gibbering mouther senses prey, its mouths begin to murmur and chatter, each with a different voice: deep or shrill, wailing or ululating, crying out in agony or ecstasy. This cacophonous gibbering overcomes the senses of any creature that hears it, causing most to flee in terror. Others are overcome with madness or stand paralyzed, fixated  on the horrific creature as it oozes forward to consume them.  All-Consuming. Driven to devour any creature it can reach, a gibbering mouther flows over victims transfixed by its mad ranting, its multitudinous voices temporarily silenced as it gnaws and swallows living flesh . The monster liquefies stone with which it comes into contact, hindering creatures that overcome its gibbering and attempt to flee.  A gibbering mouther leaves nothing of its prey  behind. However, even as the last of a victim's body is consumed, its eyes and mouth boil to the surface, ready to join the chorus of tormented gibbering that welcomes the monster's next meal. "
Githzerai Zerth,"Medium  humanoid (gith) , lawful neutral  Armor Class 17 Hit Points 84 (13d8 + 26) Speed 30 ft . "
Glabrezu," A glabrezu takes great pleasure in destroying mortals through temptation, and these creatures are among the few demons to offer their service to creatures foolish enough to summon them.  Although glabrezus are devastating in combat, they prefer to tempt victims into ruin, using power or wealth as a lure. Engaging in guile, trickery, and evil bargains, a glabrezu hoards riches that it uses to  fulfill promises to shortsighted summoners and weak-willed mortals. However,.  if its attempts to entice or deceive fail,  a glabrezu has the strength to fight and win. "
Glabrezu,"Large fiend  (demon),  chaotic evil  Armor Class 17  (natural armor) Hit Points 157  (15d10 + 75) Speed 40ft. "
Gladiator,"Medium  humanoid (any  race),  any alignment  Armor Class 16  (studded  leather, shield) Hit Points 112  (15d8 + 45) Speed 30ft. "
Gnoll Fang of Yeenoghu," Gnolls celebrate their victories by performing demonic rituals and making blood offerings to Yeenoghu. Sometimes the demon lord rewards his worshipers by allowing one of them to  be possessed by a demonic spirit. Marked as Yeenoghu's favorite,  the lucky recipient becomes a fang ofYeenoghu, the chosen of the Gnoll Lord. In much the same way Yeenoghu created the first gnolls, a hyena that feasts on  a fang's slain foe undergoes a horrible transformation, becoming a full grown adu lt gnoll. Depending on  the number of hyenas in a region, a fang of Yeenoghu can lead to a startling increase in the gnoll population. Finding and killing the fang is the only way to keep that population in check."
Gnoll Fang of Yeenoghu,"Medium fiend  (gno/1),  chaotic evil "
Gnoll Pack Lord," The alpha of a gnoll pack is the pack lord, ruling by might and cunning. A pack lord earns the best of a gnoll · pack's spoils, food,  valuable trinkets, and magic items. It ornaments its body with brutal piercings and grotesque trophies, dyeing its fur with demonic sigils, hoping Yeenoghu will make it invulnerable. "
Gnoll Pack Lord,"Medium  humanoid (gno/1) , chaotic evil  Armor Class 15  (chain  shirt) Hit Points 49  (9d8 + 9) Speed 30ft. "
Goat,"Medium  beast, unaligned  Armor Class 1 0 Hit  Points 4 (1d8) Speed 40ft. "
Goblin Boss,"Small humanoid (goblinoid),  neutral evil  Armor Class 17 (chain shirt, shield) Hit Points 21  (6d6) Speed 30ft. "
Gold Dragon Wyrmling,"Medium dragon,  lawful good  Armor Class 17  (natural armor) Hit Points 60 (8d8 + 24) Speed 30ft., fly  60ft., swim  30ft. "
Gorgon,"Few creatures that encounter a gorgon live to tell about it.  Its body is covered in iron plates, and its nostrils fume with green vapor.  Horrific Structure. A gorgon's iron plates range from  steely black to gleaming silver, but this natural armor in no way hinders its movement or mobility. The oils of its body lubricate the armor. A sick or inactive gorgon gathers rust like fungus or mange. When a rusty gorgon moves, its  plates squeal as they rub together.  Monstrous Predator. When a gorgon spots potential  prey, it charges with a hideous clamor of metal on metal. When the gorgon hits, it pulverizes the foe and sends its sprawling, then tramples it to death with its cruel hooves. Faced with multipl e foes, the gorgon exhales its deadly vapor to overcome the creatures it touches by turning them to stone. When it grows hungry, it smashes its petrified prey to  rubble and uses its strong teeth to grind the stone into a powder that provides nourishment. The crisscrossing network of trampled trails and splintered trees that s urrounds a gorgon lair is strewn with the uneaten fragments of its shattered foes.  Large monstrosity, unaligned  Armor Class 19  (natural armor) Hit Points 114  (12d10 + 48) Speed 40ft. "
Goristro," The goristro resembles a fiendish minotaur t0wering1 more than twenty feet tall. When controlled by a demon lord, goristros make formidable living siege engines and prized pets. Goristros possess preternatural cunning when navigating labyrinthine passages and shifting corridors, pursuing foes in a terrifying hunt.  A hulking goristro sometimes bears a palanquin,.  carrying smaller demons on its broad shoulders, m~ch like an elephant carries riders on its back:  r "
Gray Ooze," A gray ooze is stone turned to liquid by chaos. When it moves, it slithers like a liquid snake, fising to strike. "
Gray Ooze,"Medium ooze,  unaligned  Armor Class 8 Hit Points 22  (3d8 + 9) Speed 10ft., climb 10ft. "
Gray Slaad," Outside of Limbo, gray slaadi act as living extensions of the will of their masters, the death slaadi. A gray slaad journeys to the Material Plane on errands of doom, often taking humanoid form. A gray slaad learns how to  master the use of a greatsword and imbue it with its own innate magic.  A gray slaad that eats the entire corpse of a dead death slaad instantly transforms into a death slaad. "
Green Dragon Wyrmling,"Medium  dragon, lawful evil  Armor Class 17  (natural armor) Hit Points 38  (7d8 + 7) Speed 30ft., fly  60ft. , swim 30ft. "
Green Hag," The wretched and hateful green hags dwell in dying forests, lonely swamps, and misty moors, making their homes in caves. Green hags love to manipulate other creatures into doing their bidding, masking their intentions behind layers of deception. They lure victims to them by mimicking voices calling out for help, or drive unwanted visitors away by imitating the cries of fierce beasts.  Obsession with Tragedy. Green hags revel in the failings and tragedies of other creatures. They derive jby from bringing people low and seeing hope turn into despair, not just for individuals but also for whole nations.  Covens. A green hag that is part of a coven (see the ""Hag Covens"" sidebar) has a challenge rating of"
Grell,"Medium  aberration, neutral evil  Armor Class 12 Hit Points  55  (10d8 + 10) Speed 10ft., fly  30ft. (hover) "
Grick,"The wormlike grick waits unseen, blending in with the rock of the caves and caverns it haunts. Only when prey comes  near does it rear up, its four barbed tentacles unfurling to reveal its hungry, s napping beak.  Passive Predators. Gricks rarely hunt. Instead, they  drag their rubbery bodies  to  places where creatures regul a rly pass, lurking out of sight amid rocky rubble and debris, squeezing into burrows, holes, or crevices, climbing up to  ledges, or coiling a round stalactites to drop on unwary prey.  A grick consumes virtually anything that moves except for  other gricks. It targets the nearest prey, grabbing a fall en creature with its tentacles and  dragging it off  to eat alone.  Roving Ambush ers. Gricks remain in an area until  the food s upply dwindles, often because s entient creatures become aware of their presence and plot alternate routes a round their lairs. When prey is scarce in  the  Underd ark , gricks venture aboveground to hunt in  the wilderness, lurking in  trees or on cliff-side ledges . A grick pack is often led by a single well-fed,  oversized a lpha around which the others congregate.  Spoils of Slaughter. Over time,  grick lairs accumulate  the cast-off possessions of intelligent prey, a nd expert guides  know to  look out for  these telltale signs. Underdark explorers sometimes seal  off the routes leading to a nd from  a grick lair to s tarve them,  then cla im  the wealth of the foul  creatures' victims . "
Grimlock,"The degenerate subterranean grimlocks were once human, but their worship of the mind flayers over generations of prowling the Underdark transformed them into blind, monstrous cannibals long ago.  Debased Cultists. The empire of the mind flayers once spread across many worlds, enslaving countless races. Among those were human cultures whose high priests  the mind flayers subverted using their insidious powers of thought control. Those leaders gradually turned the faiths of their followers toward the illithids, which they worshiped as blasphemous deities.  Over time, the rituals of these enslaved humans created fervent cannibal cults that regarded the brain eating of the mind flayers as a holy sacrament. The illithids commanded their worshipers to abduct other sentient creatures to be sacrificed. After the victims' brains had been consumed, the mind flayers gave the lifeless bodies to the cultists.  Blind Hunters. When the rule of the mind flayers crumbled, their cults faced constant warfare from their enemies, the same creatures that had once been their victims. The cults fled into the Underdark domains of their illithid gods. Over generations in that lightless realm, the cultists learned to rely on their other senses for survival. In time, their eyes withered away and eyelids sealed, leaving only covered eye sockets behind. A grimlock's ears prick up at the faintest footfa ll or whisper echoing down stone passageways. It can speak in tones too low for most other humanoids to hear. The odors of sweat, flesh, a nd blood awaken its  hunger, and it can track by such scents like a bloodhound. To enhance their senses, grim locks leave tra ils of blood, piles of dung, or the viscera of slai n prey in places far from their lairs. When intruders pass  through those areas, they carry the foul scents with them, wa rning the grimlocks of their approach.  For most creatures, blindness is an enormous hindrance. For a grimlock with its other heightened senses, sightlessness is a boon. A grimlock isn't fooled by visual illusions or misperceptions. It is fearless as it stalks  prey.  Endless War.  Grimlocks still venerate the mind  flayers, serving them whenever possible. Grim locks also recall the war in which they were driven underground. To them, it has never ended. They continue to return to the surface world to abduct captives for their illithid masters. "
Guard,"Medium  humanoid (any  race),  any alignment  Armor Class 16  (chain  shirt,  shield) Hit Points 11  (2d8  + 2) Speed 30ft. "
Gynosphinx," A gynosphinx bears the head of a humanoid female. Many have the regal countenances of worldly queens, but some are marked with wild, leonine features. A gynosphinx's eyes see beyond the present time and place, and penetrate veils of invisibility and magic. Supplicants who look deep into those eyes might find themselves magically displaced, banished to some far flung plane where a difficult trial awaits them.  Gynosphinxes are virtual libraries of knowledge and lore. They ask riddles and present puzzles to  test the wit of supplicants that come to learn their secrets. Some are willing to bargain with such supplicants for treasure or service. "
Harpy,"Taking glee in suffering and death, the sadistic harpy is always on the hunt for prey. Its sweet song has lured countless adventurers to their deaths, drawing them in close for the harpy to kill and then consume.  A harpy combines the body, legs, and wings of a vulture with the torso, arms, and head of a human. Its wicked talons and bone club make it a formidable threat in combat, and its eyes reflect the absolute evil of its soul.  Divine Curse. Long ago, an elf wandering a forest heard birdsong so pure and wholesome that she was moved to  tears. Following the music, she came upon a clearing where stood a  handsome elf youth who had also paused to hear the bird's song. This was Fenmarel Mestarine, a reclusive elf god. His divine presence stole her heart as he fled,  vanishing into the woods as if he was never there.  Though the elf searched the woods and called for  her  stranger, she found no sign of his passage. Driven  o1 despair by her longing, she begged the gods to help her. Aerdrie Faenya, elf goddess of the sky, heard the elf's cries and was moved to her aid. She appeared as the bird whose song had entranced the outcast god, then taught that song of beauty and seduction to the elf. . When her singing failed  to draw Fenmarel Mestarine to  her ~ide, the elf cursed the gods, invoking a dreadful power and transforming her into the first harpy. The curse worked its magic on the elf's spirit as well as her body, turning her desire for love into a hunger for flesh,  even as her beautiful song continued to draw creatures to her deadly embrace.  Harpy Song. To hear a harpy's song is to  hear music more beautiful than anything else in  the world. A traveler that succumbs to the entrancing effect of that singing is compelled to blunder toward its source. A harpy sometimes charms victims before it attacks, but a more effective use of its song is to lure prey over cliffs, into bogs and quicksand, or into deadly pits. Creatures trapped or incapacitated then become easy targets for the harpy's wrath.  Sadistic Cowards. Harpies haunt bleak coastal cliffs  and other places hazardous to non-flying creatures. Harpies have no interest in a fair fight,  and they never attack unless they have a clear advantage. If a fight  turns against a harpy, it lacks the cunning to adapt and will flee and go hungry rather than risk straight-up combat.  When they attack, harpies play with their food, delighting in the ""music"" their victims make as they scream. A harpy takes its time dismembering a helpless foe  and can spend days torturing a victim before the merciful end.  Gruesome Collectors. Harpies take shiny baubles, valuable objects, and other trophies from  their victims, sometimes fighting with each other for the right to claim the choicest prizes. When no valuable objects can be found, a harpy takes hair, bones, or body parts to line its nest. A harpy's lair is usually hidden in remote r'uins, where adventurers can discover valuable treasure and magic hidden beneath foul  piles of offal.  Armor Class  11 Hit Points 38  (7d8 + 7) Speed 20  ft. , fly  40ft. "
Hawk,"Tiny  beast,  unaligned  Armor Class 13 Hit Points 1 (1 d4 - 1) Speed 10 ft. , fly  60  ft . "
Hezrou," Hezrous serve as foot soldiers in the demoniG h~f1des of the Abyss. Although physically powerful, they are weak minded and hezrous can easily be duped into sacrificing themselves by more powerful demons. As they press their attacks into the heart of an enemy's forces, their foul stench can sicken even the toughest foes. "
Hill Giant," Hill giants are selfish, dimwitted brutes that hunt forage, and raid in constant search of food.  They blunder through hills and forests devouring what they can, ' bullying smaller creatures into feeding them. Their laziness and dullness would long ago have spelled their end if not for their formidable size and strength.  Primitive. Hill giants dwell in hills and mountain  valleys across the world, congregating in steadings built of rough timber or in clusters of well-defended mud and-wattle huts. Their skins are tan from lives spent lumbering up and down the hilly slopes and dozing beneath the sun. Their weapons are uprooted trees and rocks pulled from  the earth. The sweat of their bodies adds to the reek of the crude animal skins they wear, poorly stitched together with hair and leather thongs.  Bigger Means Better. In a hill giant's world, humanoids and animals are easy prey that can be hunted with impunity. Creatures such as dragons and other giants are tough adversaries. Hill giants equate size with power.  Hill giants don't realize they follow an ordning. They know only that other giants are larger and stronger than they are, which means they are to be obeyed. A hill giant tribe's chief is usually the tallest and fattest giant that can still move about. Only on rare occasion does a hill giant with more brains than bulk use its cunning to gain the favor of giants of higher status, cleverly subverting the social order.  Voracious Eaters. With nothing else to occupy them, hill giants eat as often as possible. A hill giant hunts and forages alone or with a dire wolf compan ion , so as to  not have to share with other tribe members. The giant eats anything that isn't obviously deadly, such as creatures known to be poisonous. Rotten meat is fair game, though, as are decaying plants and even mud.  Farmers fear and loathe hill giants. Where a predator  such as an ankheg might burrow through fields and consume a cow or two before being driven off,  a hill giant will consume a whole herd of cattle before moving on to sheep, goats, and chickens, then tearing into fruits, vegetables, and grain. If a farm family  is at hand, the giant might snack on them too.  Stupid and Deadly. The hill giants' ability to digest nearly anything has allowed them to survive for eons as savages, eating and breeding in the hills like animals. They have never needed to adapt and change, so their minds and emotions remain simple and undeveloped. With no culture of their own, hill giants ape the traditions of creatures they manage to observe for a time before eating them. They don't think about their own size and strength, however. Tribes of hill giants attempting to imitate elves have been known to topple entire forests by trying to live in trees. Others attempting to take over humanoid towns or villages get only as far as the doors and windows of a building, taking out its walls and roof as they attempt to enter.  In conversation, hill giants are blunt and direct, and they have little concept of deception. A hill giant might be fooled into running from another giant if a number of villagers cover themselves in blankets and stand on one  ""( "
Hippogriff,"Large monstrosity, unaligned  Armor Class 11 Hit Points 19  (3d10 + 3) Speed 40 ft., fly  60 ft. "
Homunculus,"Shaping a mixture of clay, ash, mandrake root, and blood, one can channel rare ritual magic to create a faithful, squirrel-sized companion.  A homunculus is a construct that acts as an extension  of its creator, with the two sharing thoughts, senses, and language through a mystical bond. A master can have only one homunculus at a time (attempts to create another one always fail),  and when its master dies, the homunculus also dies.  Shared Mind. A homunculus knows everything its creator knows, including all the languages the creator can speak and read. Likewise, everything the construct senses is known to its master, even over great distances, provided both are on the same plane. Functioning as a spy, a scout, an emissary, or a messenger, a homunculus is an invaluable servant for a spellcaster engaged in secret experimentation or adventuring.  r88"
Hook Horror,"A fierce predator of the Underdark, the hook horror aggressively defends its hunting grounds. The subterranean caverns where these creatures dwell echo with the constant clacking and scraping of their hooks as they wend their way up cliffs and along cavern walls. The monstrous hook horror has a head resembling a vulture's and the torso of an enormous beetle, with an exoskeleton studded by sharp, bony protuberances. It gains its name from  its long, powerfully built arms a.nd legs, which end in wickedly curved hooked claws.  Echoes in the Dark. Hook horrors communicate by striking their hooks against their exoskeletons or the stone surfaces around them. What sounds to others like random clacking noise is actually a complex language that only hook horrors understand, and which carries for  miles through the echoing Underdark.  Pack Predators. The omnivorous hook horrors eat lichens, fungi,  plants, and any creature they can catch. A hook horror's hooked limbs give it excellent purchase on rock surfaces, and these creatures use their climbing skills to ambush prey from  above. They hunt in packs, working together against the largest and most dangerous opponents. If a battle goes poorly, a hook horror quickly climbs a cavern wall to flee.  Dedicated Clans. Hook horrors live in extended family groups or clans. Each clan is ruled by the eldest female, who typically places her mate in charge of the clan's hunters. Hook horrors lay eggs, which are clustered in a central, well-defended area of a clan's home caverns.  !89"
Horned Devil,"Large fiend  (devil),  lawful evil  Armor Class 18  (natural armor) Hit Points 178  (17d10 + 55) Speed 20 ft.,  fly  60 ft. "
Hunter Shark,"Large  beast,  unaligned  Armor Class 12  (natural armo r) Hit Points 45  (6d10 + 12) Speed 0 ft ., swim 40ft. "
Hydra,"The hydra is a reptilian horror with a crocodilian body and multiple heads on long, serpentine necks. Although its heads can be severed, the hydra magically regrows ' them in short order. A typical specimen has five  heads.  At the dawn of time, Tiamat, the Queen of Evil  Dragons, slew a rival dragon god named Lernaea and cast her blood across the multiverse. Each drop that fell upon a world spawned a multi-headed hydra consumed by a hunger as great as the fallen god's hatred. Great champions are known to test their mettle against these fearsome creatures.  Everlasting Hunger. A rapacious and gluttonous monster, a hydra snatches and tears ~part its prey in a frenzy of feeding. When a hydra has cleared a territory of food  and driven off any creatures smart enough to avoid it, it moves on to seek its meals elsewhere. A hydra's hunger is so great that if it can't feed,  it might turn against itself, its heads attacking each other as the creature eats itself alive.  Hardy Water DweJJers. Hydras are natural  swimmers, dwelling in rivers, along lakeshores, in ocean shallows, and in wetland bogs. A hydra rarely requires shelter from the elements, so it doesn't normally have a lair. Only in colder climes are hydras drawn to the protection of sheltered caverns and ruins.  When a hydra sleeps, at least one of its heads remains  awake and alert, making the creature difficult to catch by surprise.  Huge  monstrosity, unaligned  Armor Class 15  (natural armor) Hit  Points 172  (15d12 + 75) Speed 30ft., swim  30ft. "
Hyena,"Medium  beast, unaligned  Armor Class 11 Hit Points 5 (1d8 + 1) Speed 50 ft . "
Ice Devil,"Large fiend  (devil),  lawful evil  Armor Class 18  (natural armor) Hit Points 180  (l9d10 + 76) Speed 40ft. "
